[
  {
    "id": "1f8ebdc0-cf22-4358-8494-8d12b5272bc1",
    "cardName": "A Loving God",
    "cardType": "Magic, Standard",
    "cardNumber": "21",
    "rarity": "Epic",
    "race": "N/A",
    "background": "N/A",
    "flavorText": "N/A",
    "armorLevel": "N/A",
    "speed": "N/A",
    "healthPoints": "N/A",
    "attackName": "N/A",
    "attackDice": "N/A",
    "modifier": "N/A",
    "otherAttributes": "N/A",
    "affectsBoss": "Yes",
    "extendedEffectDescription": "Field Card. Both Players cannot battle for 3 full turn cycles. This effect starts from the moment this card is played until three turn cycles have been completed and the player who laid this card has completed their draw step. At that time combat can be initiated again and this card leaves the field.",
    "rawDescription": "Card Name: A Loving God\nCard Type: Magic, Standard\nCard Number: 21\nRarity: Epic\nRace: N/A\nBackground: N/A\nFlavor Text: N/A\nArmor Level: N/A\nSpeed: N/A\nHealth Points: N/A\nAttack Name: N/A\nAttack Dice: N/A\nModifier: N/A\nOther Attributes: N/A\nAffects Boss: Yes\nExtended Effect Description: Field Card. Both Players cannot battle for 3 full turn cycles. This effect starts from the moment this card is played until three turn cycles have been completed and the player who laid this card has completed their draw step. At that time combat can be initiated again and this card leaves the field. "
  },
  {
    "id": "dc1f9c02-5758-4c62-a85b-40c4789e2081",
    "cardName": "Allosaurus",
    "cardType": "Creature",
    "cardNumber": "123",
    "rarity": "Epic",
    "race": "Dinosaur",
    "background": "Forest",
    "flavorText": "While not as large as the T-Rex, the Allosaurus is still very deadly as they are known to travel in packs to survive.",
    "armorLevel": "9",
    "speed": "10",
    "healthPoints": "80",
    "attackName": "Bloody Chomp",
    "attackDice": "1",
    "modifier": "3",
    "otherAttributes": "N/A",
    "affectsBoss": "Yes",
    "extendedEffectDescription": "On Hit, the target creature takes 10 bleed damage. This damage over time effect occurs after the combat step has concluded for the turn this effect was applied. Damage over time effects are flat damage and receive no bonuses. This effect is continuous as long as this card is on the field. After the initial damage that occurs on hit, the effect of the Damage Over Time occurs once per turn cycle after the conclusion of the combat step.",
    "rawDescription": "Card Name: Allosaurus\nCard Type: Creature\nCard Number: 123\nRarity: Epic\nRace: Dinosaur\nBackground: Forest\nFlavor Text: While not as large as the T-Rex, the Allosaurus is still very deadly as they are known to travel in packs to survive. \nArmor Level: 9\nSpeed: 10\nHealth Points: 80\nAttack Name: Bloody Chomp\nAttack Dice: 1\nModifier: 3\nOther Attributes: N/A\nAffects Boss: Yes\nExtended Effect Description: On Hit, the target creature takes 10 bleed damage. This damage over time effect occurs after the combat step has concluded for the turn this effect was applied. Damage over time effects are flat damage and receive no bonuses. This effect is continuous as long as this card is on the field. After the initial damage that occurs on hit, the effect of the Damage Over Time occurs once per turn cycle after the conclusion of the combat step.\n"
  },
  {
    "id": "c1d16873-12b3-44f6-8a48-a5819d047724",
    "cardName": "Angel",
    "cardType": "Creature",
    "cardNumber": "135",
    "rarity": "Rare",
    "race": "Cosmic, Angelic",
    "background": "Sky",
    "flavorText": "Angels are the embodiment of the light, and main force of the creator. They are under direct control of the Eternal Titan.",
    "armorLevel": "7",
    "speed": "7",
    "healthPoints": "70",
    "attackName": "Angelic Light",
    "attackDice": "2",
    "modifier": "2",
    "otherAttributes": "Wings",
    "affectsBoss": "No",
    "extendedEffectDescription": "When summoned, return a creature from your cemetery to your hand. This card cannot be returned from the cemetery. Creatures that are sacrificed to summon the Angel to the field are eligible to be affected by the Angels effect.",
    "rawDescription": "Card Name: Angel\nCard Type: Creature\nCard Number: 135\nRarity: Rare\nRace: Cosmic, Angelic\nBackground: Sky\nFlavor Text: Angels are the embodiment of the light, and main force of the creator. They are under direct control of the Eternal Titan.\nArmor Level: 7\nSpeed: 7\nHealth Points: 70\nAttack Name: Angelic Light\nAttack Dice: 2\nModifier: 2\nOther Attributes: Wings\nAffects Boss: No\nExtended Effect Description: When summoned, return a creature from your cemetery to your hand. This card cannot be returned from the cemetery. Creatures that are sacrificed to summon the Angel to the field are eligible to be affected by the Angels effect. \n"
  },
  {
    "id": "00db5e94-14b7-4167-8921-5373fccdfaec",
    "cardName": "Assassin",
    "cardType": "Creature",
    "cardNumber": "22",
    "rarity": "Legendary",
    "race": "Humanoid, Human",
    "background": "Forest",
    "flavorText": "Although not the best combat artist, the Assassin is a master of stealth and deadly sneak attacks.",
    "armorLevel": "1",
    "speed": "12",
    "healthPoints": "10",
    "attackName": "Ambush Blade",
    "attackDice": "3",
    "modifier": "5",
    "otherAttributes": "Holding a Weapon",
    "affectsBoss": "No",
    "extendedEffectDescription": "If the Assassin hits first during a battle step then the total damage, after all dice rolls plus modifiers is calculated, is tripled. Multipliers are the last thing applied to the addition and multiplication equation for calculating damage. Additional multipliers can be applied to this card and added at the end of the equation.",
    "rawDescription": "Card Name: Assassin\nCard Type: Creature\nCard Number: 22\nRarity: Legendary\nRace: Humanoid, Human\nBackground: Forest\nFlavor Text: Although not the best combat artist, the Assassin is a master of stealth and deadly sneak attacks. \nArmor Level: 1\nSpeed: 12\nHealth Points: 10\nAttack Name: Ambush Blade\nAttack Dice: 3\nModifier: 5\nOther Attributes: Holding a Weapon\nAffects Boss: No\nExtended Effect Description: If the Assassin hits first during a battle step then the total damage, after all dice rolls plus modifiers is calculated, is tripled. Multipliers are the last thing applied to the addition and multiplication equation for calculating damage. Additional multipliers can be applied to this card and added at the end of the equation.\n"
  },
  {
    "id": "54080fe9-c58d-4d3d-9967-d92cf5b945b7",
    "cardName": "Backstab",
    "cardType": "Magic, Standard",
    "cardNumber": "23",
    "rarity": "Legendary",
    "race": "N/A",
    "background": "N/A",
    "flavorText": "N/A",
    "armorLevel": "N/A",
    "speed": "N/A",
    "healthPoints": "N/A",
    "attackName": "N/A",
    "attackDice": "N/A",
    "modifier": "N/A",
    "otherAttributes": "N/A",
    "affectsBoss": "Yes",
    "extendedEffectDescription": "During your turn, this card allows a target creature on your side of the field to have the following effects: Attack first during battle, Automatically Hit regardless of the result of the Hit Dice Roll, and apply a 3x Damage multiplier at the end of your damage calculations (multiple backstabs or any other creature/magic cards that add a damage multiplier would be multiplied together, use PEMDAS to calculate the overall damage. Example: 3 Backstab’s 3*3*3=27x damage multiplier). This card's ability to automatically Hit would supersede the creature effect of scarlet or other hit reducing cards such as ring of extremes.",
    "rawDescription": "Card Name: Backstab\nCard Type: Magic, Standard\nCard Number: 23\nRarity: Legendary\nRace: N/A\nBackground: N/A\nFlavor Text: N/A\nArmor Level: N/A\nSpeed: N/A\nHealth Points: N/A\nAttack Name: N/A\nAttack Dice: N/A\nModifier: N/A\nOther Attributes: N/A\nAffects Boss: Yes\nExtended Effect Description: During your turn, this card allows a target creature on your side of the field to have the following effects: Attack first during battle, Automatically Hit regardless of the result of the Hit Dice Roll, and apply a 3x Damage multiplier at the end of your damage calculations (multiple backstabs or any other creature/magic cards that add a damage multiplier would be multiplied together, use PEMDAS to calculate the overall damage. Example: 3 Backstab’s 3*3*3=27x damage multiplier). This card's ability to automatically Hit would supersede the creature effect of scarlet or other hit reducing cards such as ring of extremes."
  },
  {
    "id": "c04741d2-49c4-4fc8-8ddf-380cf50170d0",
    "cardName": "Ball and Chain",
    "cardType": "Magic, Infinite, Equip",
    "cardNumber": "24",
    "rarity": "Common",
    "race": "N/A",
    "background": "N/A",
    "flavorText": "N/A",
    "armorLevel": "N/A",
    "speed": "N/A",
    "healthPoints": "N/A",
    "attackName": "N/A",
    "attackDice": "N/A",
    "modifier": "N/A",
    "otherAttributes": "N/A",
    "affectsBoss": "Yes",
    "extendedEffectDescription": "Equip: Target a creature and reduce the equipped creature's speed stat by 6 points as long as this card is equipped to that card. This card remains in the magic play area of the person who played it. This card negates any speed stat increases from other creature effects or magic cards.",
    "rawDescription": "Card Name: Ball and Chain\nCard Type: Magic, Infinite, Equip\nCard Number: 24\nRarity: Common\nRace: N/A\nBackground: N/A\nFlavor Text: N/A\nArmor Level: N/A\nSpeed: N/A\nHealth Points: N/A\nAttack Name: N/A\nAttack Dice: N/A\nModifier: N/A\nOther Attributes: N/A\nAffects Boss: Yes\nExtended Effect Description: Equip: Target a creature and reduce the equipped creature's speed stat by 6 points as long as this card is equipped to that card. This card remains in the magic play area of the person who played it. This card negates any speed stat increases from other creature effects or magic cards."
  },
  {
    "id": "561bbea9-425e-4678-a6e6-33a3a818e20c",
    "cardName": "Basilisk",
    "cardType": "Creature",
    "cardNumber": "25",
    "rarity": "Epic",
    "race": "Beast",
    "background": "Forest",
    "flavorText": "This monster searches the darkest areas of the world for its prey. Even dragons fear the mighty Basilisk.",
    "armorLevel": "10",
    "speed": "5",
    "healthPoints": "100",
    "attackName": "Toxic Strike",
    "attackDice": "2",
    "modifier": "3",
    "otherAttributes": "N/A",
    "affectsBoss": "Yes",
    "extendedEffectDescription": "While on the field the target creature takes 5 poison damage once per turn cycle until this card leaves the field. This effect occurs at the end of the combat phase and prior to the wrap-up phase.",
    "rawDescription": "Card Name: Basilisk\nCard Type: Creature\nCard Number: 25\nRarity: Epic\nRace: Beast\nBackground: Forest\nFlavor Text: This monster searches the darkest areas of the world for its prey. Even dragons fear the mighty Basilisk.\nArmor Level: 10\nSpeed: 5\nHealth Points: 100\nAttack Name: Toxic Strike\nAttack Dice: 2\nModifier: 3\nOther Attributes: N/A\nAffects Boss: Yes\nExtended Effect Description: While on the field the target creature takes 5 poison damage once per turn cycle until this card leaves the field. This effect occurs at the end of the combat phase and prior to the wrap-up phase. \n"
  },
  {
    "id": "e6dcad6e-b34c-4684-a057-a386b89a34e7",
    "cardName": "Behemoth",
    "cardType": "Creature",
    "cardNumber": "26",
    "rarity": "Epic",
    "race": "Beast",
    "background": "Forest",
    "flavorText": "These creatures spend their free time tracking down adventurers for an easy kill.",
    "armorLevel": "10",
    "speed": "6",
    "healthPoints": "100",
    "attackName": "Quake",
    "attackDice": "3",
    "modifier": "4",
    "otherAttributes": "N/A",
    "affectsBoss": "No",
    "extendedEffectDescription": "N/A",
    "rawDescription": "Card Name: Behemoth\nCard Type: Creature\nCard Number: 26\nRarity: Epic\nRace: Beast\nBackground: Forest\nFlavor Text: These creatures spend their free time tracking down adventurers for an easy kill.\nArmor Level: 10\nSpeed: 6\nHealth Points: 100\nAttack Name: Quake\nAttack Dice: 3\nModifier: 4\nOther Attributes: N/A\nAffects Boss: No\nExtended Effect Description: N/A"
  },
  {
    "id": "d88174e6-7886-45d5-9661-84df6c86ad5a",
    "cardName": "Black Dragon",
    "cardType": "Creature",
    "cardNumber": "27",
    "rarity": "Rare",
    "race": "Dragon",
    "background": "Forest",
    "flavorText": "Black dragons were formally red dragons. They betrayed their brethren and allied with the Fire God. This turned their scales as black as ash.",
    "armorLevel": "10",
    "speed": "9",
    "healthPoints": "100",
    "attackName": "Dragon Beam",
    "attackDice": "3",
    "modifier": "3",
    "otherAttributes": "Wings",
    "affectsBoss": "Yes",
    "extendedEffectDescription": "During your turn, roll 1 die. If 6, your opponent must skip their next turn. This completely skips your opponent's turn. If you rolled a 6 at the end of your turn you will then begin a new turn and start by drawing a card as if your opponent had just ended their turn.",
    "rawDescription": "Card Name: Black Dragon\nCard Type: Creature\nCard Number: 27\nRarity: Rare\nRace: Dragon\nBackground: Forest\nFlavor Text: Black dragons were formally red dragons. They betrayed their brethren and allied with the Fire God. This turned their scales as black as ash. \nArmor Level: 10\nSpeed: 9\nHealth Points: 100\nAttack Name: Dragon Beam\nAttack Dice: 3\nModifier: 3\nOther Attributes: Wings\nAffects Boss: Yes\nExtended Effect Description: During your turn, roll 1 die. If 6, your opponent must skip their next turn. This completely skips your opponent's turn. If you rolled a 6 at the end of your turn you will then begin a new turn and start by drawing a card as if your opponent had just ended their turn. \n"
  },
  {
    "id": "e81bf0b9-a277-4bd0-8f7d-4dd578c0576a",
    "cardName": "Blade in the Dark",
    "cardType": "Magic, Lightning",
    "cardNumber": "28",
    "rarity": "Rare",
    "race": "N/A",
    "background": "N/A",
    "flavorText": "N/A",
    "armorLevel": "N/A",
    "speed": "N/A",
    "healthPoints": "N/A",
    "attackName": "N/A",
    "attackDice": "N/A",
    "modifier": "N/A",
    "otherAttributes": "N/A",
    "affectsBoss": "Yes",
    "extendedEffectDescription": "When your opponent casts a magic card, negate the card effect and send it to the cemetery. This card stops the activation of another magic card and therefore the attempted to be played magic card never has its effect activated and will go to the cemetery. Example: Heroism magic card is immune to magic cards. However, due to Blade in the Dark negating the magic card before its effect can occur, Blade in the Dark would destroy the Heroism magic card and send it to the cemetery.",
    "rawDescription": "Card Name: Blade in the Dark\nCard Type: Magic, Lightning \nCard Number: 28\nRarity: Rare\nRace: N/A\nBackground: N/A\nFlavor Text: N/A\nArmor Level: N/A\nSpeed: N/A\nHealth Points: N/A\nAttack Name: N/A\nAttack Dice: N/A\nModifier: N/A\nOther Attributes: N/A\nAffects Boss: Yes\nExtended Effect Description: When your opponent casts a magic card, negate the card effect and send it to the cemetery. This card stops the activation of another magic card and therefore the attempted to be played magic card never has its effect activated and will go to the cemetery. Example: Heroism magic card is immune to magic cards. However, due to Blade in the Dark negating the magic card before its effect can occur, Blade in the Dark would destroy the Heroism magic card and send it to the cemetery.\n"
  },
  {
    "id": "603fab78-9456-4ec1-861b-392f04064a36",
    "cardName": "Blood of the Bat",
    "cardType": "Magic, Equip",
    "cardNumber": "29",
    "rarity": "Legendary",
    "race": "N/A",
    "background": "N/A",
    "flavorText": "N/A",
    "armorLevel": "N/A",
    "speed": "N/A",
    "healthPoints": "N/A",
    "attackName": "N/A",
    "attackDice": "N/A",
    "modifier": "N/A",
    "otherAttributes": "N/A",
    "affectsBoss": "No",
    "extendedEffectDescription": "Equip: Add lifesteal to this creature. Heal the equipped creature for half the amount of attack damage the equipped card inflicts on the target creature it attacks. If a reflect spell or or other block spell is used the creature equipped with Blood of the bat does not heal. Only direct battle damage counts towards this card's effect.",
    "rawDescription": "Card Name: Blood of the Bat\nCard Type: Magic, Equip\nCard Number: 29\nRarity: Legendary\nRace: N/A\nBackground: N/A\nFlavor Text: N/A\nArmor Level: N/A\nSpeed: N/A\nHealth Points: N/A\nAttack Name: N/A\nAttack Dice: N/A\nModifier: N/A\nOther Attributes: N/A\nAffects Boss: No\nExtended Effect Description: Equip: Add lifesteal to this creature. Heal the equipped creature for half the amount of attack damage the equipped card inflicts on the target creature it attacks. If a reflect spell or or other block spell is used the creature equipped with Blood of the bat does not heal. Only direct battle damage counts towards this card's effect.\n"
  },
  {
    "id": "863e9eee-7a66-45bc-8a59-4b414d587d14",
    "cardName": "Blue Dragon",
    "cardType": "Creature",
    "cardNumber": "1",
    "rarity": "Rare",
    "race": "Dragon",
    "background": "Mountains",
    "flavorText": "While not as powerful as the red dragons, blue dragons are cunning beasts of the winter frost.",
    "armorLevel": "9",
    "speed": "9",
    "healthPoints": "90",
    "attackName": "Sub Zero",
    "attackDice": "2",
    "modifier": "2",
    "otherAttributes": "N/A",
    "affectsBoss": "Yes",
    "extendedEffectDescription": "On hit, roll 1 die. If 4-6, your target is frozen for one turn cycle and cannot battle or be sacrificed. If a creature is frozen during a battle and the frozen creature goes second they cannot rebuttal during that battle. A frozen creature may be killed and another creature can be summoned. However, the frozen creature cannot be used as sacrifice material for the newly summoned creature.",
    "rawDescription": "Card Name: Blue Dragon\nCard Type: Creature\nCard Number: 1\nRarity: Rare\nRace: Dragon\nBackground: Mountains \nFlavor Text: While not as powerful as the red dragons, blue dragons are cunning beasts of the winter frost. \nArmor Level: 9\nSpeed: 9\nHealth Points: 90\nAttack Name: Sub Zero\nAttack Dice: 2\nModifier: 2\nOther Attributes: N/A \nAffects Boss: Yes\nExtended Effect Description: On hit, roll 1 die. If 4-6, your target is frozen for one turn cycle and cannot battle or be sacrificed. If a creature is frozen during a battle and the frozen creature goes second they cannot rebuttal during that battle. A frozen creature may be killed and another creature can be summoned. However, the frozen creature cannot be used as sacrifice material for the newly summoned creature. \n"
  },
  {
    "id": "1508d3b7-06f2-4b38-9893-25bad6057abb",
    "cardName": "Children of The Forest",
    "cardType": "Magic, Lightning",
    "cardNumber": "30",
    "rarity": "Epic",
    "race": "N/A",
    "background": "N/A",
    "flavorText": "N/A",
    "armorLevel": "N/A",
    "speed": "N/A",
    "healthPoints": "N/A",
    "attackName": "N/A",
    "attackDice": "N/A",
    "modifier": "N/A",
    "otherAttributes": "N/A",
    "affectsBoss": "No",
    "extendedEffectDescription": "On hit, play this card from your hand. Add 5 extra Attack dice rolls to your attacking creature for this battle. This only adds extra damage to an attack. This card does not add extra Hit Dice rolls.",
    "rawDescription": "Card Name:  Children of The Forest\nCard Type:  Magic, Lightning\nCard Number: 30\nRarity: Epic\nRace: N/A\nBackground: N/A\nFlavor Text: N/A\nArmor Level: N/A\nSpeed: N/A\nHealth Points: N/A\nAttack Name: N/A\nAttack Dice: N/A\nModifier: N/A\nOther Attributes: N/A\nAffects Boss: No\nExtended Effect Description: On hit, play this card from your hand. Add 5 extra Attack dice rolls to your attacking creature for this battle. This only adds extra damage to an attack. This card does not add extra Hit Dice rolls.\n"
  },
  {
    "id": "34ba1d7c-83a2-4b58-97e2-ba49d0031b61",
    "cardName": "Cosmic Demon",
    "cardType": "Creature",
    "cardNumber": "31",
    "rarity": "Legendary",
    "race": "Cosmic",
    "background": "Space",
    "flavorText": "An eternal being of destruction. If the Creator shaped the cosmos, then the Cosmic Demon will be the one to destroy it.",
    "armorLevel": "12",
    "speed": "6",
    "healthPoints": "120",
    "attackName": "Black Hole",
    "attackDice": "6",
    "modifier": "6",
    "otherAttributes": "Stars",
    "affectsBoss": "No",
    "extendedEffectDescription": "N/A",
    "rawDescription": "Card Name: Cosmic Demon\nCard Type: Creature\nCard Number: 31\nRarity: Legendary\nRace: Cosmic\nBackground: Space\nFlavor Text: An eternal being of destruction. If the Creator shaped the cosmos, then the Cosmic Demon will be the one to destroy it. \nArmor Level: 12\nSpeed: 6\nHealth Points: 120 \nAttack Name: Black Hole\nAttack Dice: 6\nModifier: 6\nOther Attributes: Stars\nAffects Boss: No\nExtended Effect Description: N/A\n"
  },
  {
    "id": "5437fde4-1611-4cd7-9ff6-6a1aef650e98",
    "cardName": "Cosmic Negation",
    "cardType": "Magic, Standard",
    "cardNumber": "112",
    "rarity": "Legendary",
    "race": "N/A",
    "background": "N/A",
    "flavorText": "N/A",
    "armorLevel": "N/A",
    "speed": "N/A",
    "healthPoints": "N/A",
    "attackName": "N/A",
    "attackDice": "N/A",
    "modifier": "N/A",
    "otherAttributes": "N/A",
    "affectsBoss": "Yes",
    "extendedEffectDescription": "Field: Destroy all magic cards on the field. Magic cards cannot be played or activated for 3 turn cycles. This affects the entire play field. Once the 3 turn cycles have concluded Cosmic Negation is destroyed and sent to the Cemetery.",
    "rawDescription": "Card Name: Cosmic Negation\nCard Type: Magic, Standard\nCard Number: 112\nRarity: Legendary\nRace: N/A\nBackground: N/A\nFlavor Text: N/A\nArmor Level: N/A\nSpeed: N/A\nHealth Points: N/A\nAttack Name: N/A\nAttack Dice: N/A\nModifier: N/A\nOther Attributes: N/A\nAffects Boss: Yes\nExtended Effect Description: Field: Destroy all magic cards on the field. Magic cards cannot be played or activated for 3 turn cycles. This affects the entire play field. Once the 3 turn cycles have concluded Cosmic Negation is destroyed and sent to the Cemetery. \n"
  },
  {
    "id": "7e8db914-817a-41c5-87ff-1c298e0415a7",
    "cardName": "Council of the Cosmos",
    "cardType": "32",
    "cardNumber": "Magic, Standard",
    "rarity": "Rare",
    "race": "N/A",
    "background": "N/A",
    "flavorText": "N/A",
    "armorLevel": "N/A",
    "speed": "N/A",
    "healthPoints": "N/A",
    "attackName": "N/A",
    "attackDice": "N/A",
    "modifier": "N/A",
    "otherAttributes": "N/A",
    "affectsBoss": "Yes, if used on boss.",
    "extendedEffectDescription": "Destroy 1 magic card on the field.",
    "rawDescription": "Card Name: Council of the Cosmos\nCard Type: 32\nCard Number: Magic, Standard\nRarity: Rare\nRace: N/A\nBackground: N/A\nFlavor Text: N/A\nArmor Level: N/A\nSpeed: N/A\nHealth Points: N/A\nAttack Name: N/A\nAttack Dice: N/A\nModifier: N/A\nOther Attributes: N/A\nAffects Boss: Yes, if used on boss.\nExtended Effect Description: Destroy 1 magic card on the field.\n"
  },
  {
    "id": "dfb40079-0afd-4684-b761-14b60af2f78d",
    "cardName": "Curse",
    "cardType": "Magic, Infinite, Field",
    "cardNumber": "49",
    "rarity": "Epic",
    "race": "N/A",
    "background": "N/A",
    "flavorText": "N/A",
    "armorLevel": "N/A",
    "speed": "N/A",
    "healthPoints": "N/A",
    "attackName": "N/A",
    "attackDice": "N/A",
    "modifier": "N/A",
    "otherAttributes": "N/A",
    "affectsBoss": "Yes",
    "extendedEffectDescription": "Field: All creatures on the opposing side field have their Armor Level reduced to 1. This card supersedes other Armor Level increasing cards. This card does not affect cards such as Heroism due to the card's antimagic effect.",
    "rawDescription": "Card Name: Curse\nCard Type: Magic, Infinite, Field\nCard Number: 49\nRarity: Epic\nRace: N/A\nBackground: N/A\nFlavor Text: N/A\nArmor Level: N/A\nSpeed: N/A\nHealth Points: N/A\nAttack Name: N/A\nAttack Dice: N/A\nModifier: N/A\nOther Attributes: N/A\nAffects Boss: Yes\nExtended Effect Description: Field: All creatures on the opposing side field have their Armor Level reduced to 1. This card supersedes other Armor Level increasing cards. This card does not affect cards such as Heroism due to the card's antimagic effect. \n"
  },
  {
    "id": "ae1ea92c-0339-4f03-a8c6-678bccd47bbc",
    "cardName": "Dark Elf",
    "cardType": "Creature",
    "cardNumber": "33",
    "rarity": "Uncommon",
    "race": "Humanoid, Dark Elf",
    "background": "Forest",
    "flavorText": "These elves are followers of the dark arcane arts. Dark Elves are considered mysterious to the civilized world.",
    "armorLevel": "4",
    "speed": "8",
    "healthPoints": "40",
    "attackName": "Dark Essence",
    "attackDice": "1",
    "modifier": "0",
    "otherAttributes": "N/A",
    "affectsBoss": "No",
    "extendedEffectDescription": "When this card hits, roll 1 die, If the result of this dice roll is 1-3 you can roll 4 extra Attack Dice for this battle. This effect can only be applied once per battle.",
    "rawDescription": "Card Name: Dark Elf\nCard Type: Creature\nCard Number: 33\nRarity: Uncommon\nRace: Humanoid, Dark Elf\nBackground: Forest\nFlavor Text: These elves are followers of the dark arcane arts. Dark Elves are considered mysterious to the civilized world. \nArmor Level: 4\nSpeed: 8\nHealth Points: 40\nAttack Name: Dark Essence\nAttack Dice: 1\nModifier: 0\nOther Attributes: N/A\nAffects Boss: No\nExtended Effect Description: When this card hits, roll 1 die, If the result of this dice roll is 1-3 you can roll 4 extra Attack Dice for this battle. This effect can only be applied once per battle. \n"
  },
  {
    "id": "d6cc16c5-a018-43a2-8f45-d99bbe14e50e",
    "cardName": "Dark Knight",
    "cardType": "Creature",
    "cardNumber": "34",
    "rarity": "Epic",
    "race": "Humanoid, Human",
    "background": "Forest",
    "flavorText": "Once a knight of The Light. These wicked beings have fallen to a darker path on the road to justice.They do not see themselves as evil.",
    "armorLevel": "8",
    "speed": "5",
    "healthPoints": "90",
    "attackName": "Shadow Blade",
    "attackDice": "2",
    "modifier": "2",
    "otherAttributes": "Holding a Weapon",
    "affectsBoss": "No",
    "extendedEffectDescription": "During the player who controls this card's turn this creature may summon 1 undead creature back to the field from the card owner's cemetery as a limited summoned creature. This card may only control 1 summoned undead on the field at a time. If this effect is nullified in any way, or this card leaves the field for any reason, send the summoned undead creature back to the cemetery. Summoned creatures may be sent back to the owner's hand through various card effects such as Wrath of the Old ones. Summoned undead do not change ownership along with Dark Knight if Dark Knight changes ownership through various card effects.",
    "rawDescription": "Card Name: Dark Knight\nCard Type: Creature\nCard Number: 34\nRarity: Epic\nRace: Humanoid, Human\nBackground: Forest\nFlavor Text: Once a knight of The Light. These wicked beings have fallen to a darker path on the road to justice.They do not see themselves as evil. \nArmor Level: 8\nSpeed: 5\nHealth Points: 90\nAttack Name: Shadow Blade\nAttack Dice: 2\nModifier: 2\nOther Attributes: Holding a Weapon\nAffects Boss: No\nExtended Effect Description: During the player who controls this card's turn this creature may summon 1 undead creature back to the field from the card owner's cemetery as a limited summoned creature. This card may only control 1 summoned undead on the field at a time. If this effect is nullified in any way, or this card leaves the field for any reason, send the summoned undead creature back to the cemetery. Summoned creatures may be sent back to the owner's hand through various card effects such as Wrath of the Old ones. Summoned undead do not change ownership along with Dark Knight if Dark Knight changes ownership through various card effects.\n"
  },
  {
    "id": "50d79356-94aa-41d0-8ec1-126df9edb817",
    "cardName": "Dark Lord",
    "cardType": "Creature",
    "cardNumber": "35",
    "rarity": "Epic",
    "race": "Humanoid, Human",
    "background": "Neutral",
    "flavorText": "Dark ruler of the Under Lands. This man has devoted himself to proving that men can be as powerful as gods.",
    "armorLevel": "12",
    "speed": "5",
    "healthPoints": "120",
    "attackName": "Abyss Slash",
    "attackDice": "4",
    "modifier": "2",
    "otherAttributes": "N/A",
    "affectsBoss": "No",
    "extendedEffectDescription": "N/A",
    "rawDescription": "Card Name: Dark Lord\nCard Type:  Creature\nCard Number: 35\nRarity: Epic\nRace: Humanoid, Human\nBackground: Neutral\nFlavor Text: Dark ruler of the Under Lands. This man has devoted himself to proving that men can be as powerful as gods.\nArmor Level: 12\nSpeed: 5\nHealth Points: 120\nAttack Name: Abyss Slash\nAttack Dice: 4\nModifier: 2\nOther Attributes: N/A\nAffects Boss: No\nExtended Effect Description: N/A\n"
  },
  {
    "id": "46c18789-b059-49ff-8ffc-2d9dcdef8be4",
    "cardName": "Death from Above",
    "cardType": "Magic, Standard, Field",
    "cardNumber": "36",
    "rarity": "Uncommon",
    "race": "N/A",
    "background": "N/A",
    "flavorText": "N/A",
    "armorLevel": "N/A",
    "speed": "N/A",
    "healthPoints": "N/A",
    "attackName": "N/A",
    "attackDice": "N/A",
    "modifier": "N/A",
    "otherAttributes": "N/A",
    "affectsBoss": "Yes",
    "extendedEffectDescription": "This card affects all creatures on your side of the field: For one turn cycle, this card allows creatures under your control on your side of the field to hit their targets regardless of the result of the Hit Dice roll. Double 6’s (Critical Hit damage) still applies and does double damage. Critical Misses do not count against the player who used this card. This card's ability to automatically Hit would supersede the creature effect of scarlet or other hit reducing cards such as ring of extremes.",
    "rawDescription": "Card Name: Death from Above\nCard Type: Magic, Standard, Field\nCard Number: 36\nRarity: Uncommon\nRace: N/A\nBackground: N/A\nFlavor Text: N/A\nArmor Level: N/A\nSpeed: N/A\nHealth Points: N/A\nAttack Name: N/A\nAttack Dice: N/A\nModifier: N/A\nOther Attributes: N/A\nAffects Boss: Yes\nExtended Effect Description: This card affects all creatures on your side of the field: For one turn cycle, this card allows creatures under your control on your side of the field to hit their targets regardless of the result of the Hit Dice roll. Double 6’s (Critical Hit damage) still applies and does double damage. Critical Misses do not count against the player who used this card. This card's ability to automatically Hit would supersede the creature effect of scarlet or other hit reducing cards such as ring of extremes. \n"
  },
  {
    "id": "99f53389-e075-4aed-a233-3bab65c6a120",
    "cardName": "Demon",
    "cardType": "Creature",
    "cardNumber": "136",
    "rarity": "Common",
    "race": "Demon",
    "background": "Neutral",
    "flavorText": "The main force of the Demon King's army. These creatures thrive on inflicting pain. Demons have an uncanny hatred for the undead, seeing them as an abomination.",
    "armorLevel": "4",
    "speed": "8",
    "healthPoints": "40",
    "attackName": "Torture",
    "attackDice": "2",
    "modifier": "1",
    "otherAttributes": "Wings",
    "affectsBoss": "No",
    "extendedEffectDescription": "N/A",
    "rawDescription": "Card Name: Demon\nCard Type: Creature\nCard Number: 136\nRarity: Common\nRace: Demon\nBackground: Neutral\nFlavor Text: The main force of the Demon King's army. These creatures thrive on inflicting pain. Demons have an uncanny hatred for the undead, seeing them as an abomination. \nArmor Level: 4\nSpeed: 8\nHealth Points: 40\nAttack Name: Torture\nAttack Dice: 2\nModifier: 1\nOther Attributes: Wings\nAffects Boss: No\nExtended Effect Description: N/A"
  },
  {
    "id": "2bbdc200-09c9-4819-957f-d2c0283ce4dc",
    "cardName": "Demon King",
    "cardType": "Creature",
    "cardNumber": "37",
    "rarity": "Epic",
    "race": "Demon",
    "background": "Fire",
    "flavorText": "The ruler of Hell, and enemy of The Light. The Demon King has led two full scale invasions into Ward. Both were a terrible failure. He answers only to the Cosmic Demon, however, he shares no love for his celestial master.",
    "armorLevel": "12",
    "speed": "8",
    "healthPoints": "100",
    "attackName": "Hell Fire",
    "attackDice": "3",
    "modifier": "4",
    "otherAttributes": "N/A",
    "affectsBoss": "Yes",
    "extendedEffectDescription": "During your turn, you may roll 1 die. If the result of the dice roll is 1-2, destroy all magic cards on your opponent's side of the field.",
    "rawDescription": "Card Name: Demon King\nCard Type: Creature\nCard Number: 37\nRarity: Epic\nRace: Demon\nBackground: Fire\nFlavor Text: The ruler of Hell, and enemy of The Light. The Demon King has led two full scale invasions into Ward. Both were a terrible failure. He answers only to the Cosmic Demon, however, he shares no love for his celestial master.\nArmor Level: 12\nSpeed: 8\nHealth Points: 100\nAttack Name: Hell Fire\nAttack Dice: 3\nModifier: 4\nOther Attributes: N/A\nAffects Boss: Yes\nExtended Effect Description: During your turn, you may roll 1 die. If the result of the dice roll is 1-2, destroy all magic cards on your opponent's side of the field. "
  },
  {
    "id": "fb338543-a779-4603-9716-e72a5c6dbbff",
    "cardName": "Demon Knight",
    "cardType": "Creature",
    "cardNumber": "38",
    "rarity": "Epic",
    "race": "Demon",
    "background": "Fire",
    "flavorText": "During the empire of man many knights sold their souls to the demon king in exchange for power. They now hold more power than any human knight, but are bound to hell for an eternity of torment.",
    "armorLevel": "9",
    "speed": "7",
    "healthPoints": "70",
    "attackName": "Searing Blade",
    "attackDice": "2",
    "modifier": "2",
    "otherAttributes": "N/A",
    "affectsBoss": "Yes",
    "extendedEffectDescription": "During your turn roll 1 die. If the result of the dice roll is 4-6 your opponent's primary creature is burned for 10 Health Points of damage.",
    "rawDescription": "Card Name: Demon Knight\nCard Type: Creature\nCard Number: 38\nRarity: Epic\nRace: Demon\nBackground: Fire\nFlavor Text: During the empire of man many knights sold their souls to the demon king in exchange for power. They now hold more power than any human knight, but are bound to hell for an eternity of torment.\nArmor Level: 9\nSpeed: 7\nHealth Points: 70\nAttack Name: Searing Blade\nAttack Dice: 2\nModifier: 2\nOther Attributes: N/A\nAffects Boss: Yes\nExtended Effect Description: During your turn roll 1 die. If the result of the dice roll is 4-6 your opponent's primary creature is burned for 10 Health Points of damage. "
  },
  {
    "id": "27fac13d-d636-4aad-afa7-c664f07bd4e8",
    "cardName": "Demonic Magic",
    "cardType": "Magic, Infinite, Equip",
    "cardNumber": "39",
    "rarity": "Rare",
    "race": "N/A",
    "background": "N/A",
    "flavorText": "N/A",
    "armorLevel": "N/A",
    "speed": "N/A",
    "healthPoints": "N/A",
    "attackName": "N/A",
    "attackDice": "N/A",
    "modifier": "N/A",
    "otherAttributes": "N/A",
    "affectsBoss": "Yes",
    "extendedEffectDescription": "Equip this card to a creature on the field. Once equipped the equipped creature has their remaining Health Points reduced by half and gain +5 to both their Hit and Attack Modifiers. This card has a secondary effect that negates all creature effects for any creature on the field. Continuous effects such as Necromancer's resurrection abilities would be stopped and the resurrected creature would be sent back to the cemetery until this card's effect ends.",
    "rawDescription": "Card Name: Demonic Magic\nCard Type: Magic, Infinite, Equip\nCard Number: 39\nRarity: Rare\nRace: N/A\nBackground: N/A\nFlavor Text: N/A\nArmor Level: N/A\nSpeed: N/A\nHealth Points: N/A\nAttack Name: N/A\nAttack Dice: N/A\nModifier: N/A\nOther Attributes: N/A\nAffects Boss: Yes\nExtended Effect Description: Equip this card to a creature on the field. Once equipped the equipped creature has their remaining Health Points reduced by half and gain +5 to both their Hit and Attack Modifiers. This card has a secondary effect that negates all creature effects for any creature on the field. Continuous effects such as Necromancer's resurrection abilities would be stopped and the resurrected creature would be sent back to the cemetery until this card's effect ends."
  }
]